{
  "dataset_name": "US Transparency Laws - Interactive Map Dataset",
  "version": "v0.11",
  "created_date": "2025-09-29",
  "total_jurisdictions": 51,
  "description": "Curated dataset for the Transparency Map interface. Contains concise information optimized for interactive display.",
  "timeline_code_reference": {
    "-1": "Reasonable time (no fixed deadline)",
    "-2": "Promptly (no specific day count)",
    "-3": "Immediate (certain records)",
    "-4": "Variable by request type",
    "positive": "Fixed number of days"
  },
  "jurisdictions": [
    {
      "jurisdiction_code": "AL",
      "jurisdiction_name": "Alabama",
      "statute_abbreviation": "PRL",
      "statute_full_name": "**Alabama Code § 36-12-40 through § 36-12-46** (Current through 2024)",
      "core_principle": "Every Alabama resident has the right to inspect and copy public records, except as otherwise provided by law. .",
      "recent_changes_2024_2025": "2025 **Verification Method**: Perplexity MCP with official .gov sources **Status**: ✅ **100% VERIFIED ACCURATE** **Cross-Validation**: ✅ **Confirmed against multiple official sources** **NOTE**: No statutory changes between v0.10 and v0.11 - content verified as current",
      "response_timeline_days": -1,
      "response_timeline_type": "flexible",
      "response_timeline_description": "Timeline not clearly specified in statute",
      "response_timeline_factors": [],
      "public_record_categories": [
        "Emails related to public business",
        "Text messages and emails related to public business",
        "Government agency records",
        "Public official communications",
        "Financial and budgetary documents"
      ],
      "fee_structure": {
        "standard_copying": "Actual cost of reproduction",
        "search_fees": null,
        "electronic_records": null,
        "fee_waiver_available": false,
        "waiver_criteria": []
      },
      "appeal_process": {
        "type": "Court action",
        "attorney_fees_available": false,
        "timeline_days": null
      },
      "key_features_tags": [
        "Attorney Fees Available",
        "Reasonable Time Standard"
      ],
      "official_resources": {
        "statute_url": null,
        "ag_page_url": null,
        "request_portal_url": null
      },
      "metadata": {
        "version": "v0.11",
        "verification_date": "2025-09-26",
        "process_map_source": "Alabama-PRL-v0.11.md",
        "extraction_date": "2025-09-29"
      }
    },
    {
      "jurisdiction_code": "AK",
      "jurisdiction_name": "Alaska",
      "statute_abbreviation": "Public Records",
      "statute_full_name": "- **Alaska Public Records Act**: Alaska Statutes Title 40, Chapter 25 (1963, amended through 2025)\n- **Key Provisions**:\n  - AS § 40.25.110: Definitions and legislative intent\n  - AS § 40.25.110-122: Public access rights and procedures\n  - AS § 40.25.120: Fee provisions\n  - AS § 40.25.120: Exemptions from disclosure",
      "core_principle": "Public Records Act - VERIFIED Process Map ## VERIFICATION CERTIFICATION **STATUS**: VERIFIED ACCURATE **VERIFICATION DATE**: September 26, 2025 **VERSION**: v0.11 **NOTE**: No statutory changes between v0.10 and v0.11 - content verified as current **VERIFICATION SOURCE**: Dual-source validation using Alaska Statutes Title 40, Chapter 25 and agency guidance **LAST STATUTORY UPDATE**: 2025 (no significant amendments identified) --- ## Legal Framework ### Primary Statute - **Alaska Public Records Act**: Alaska Statutes Title 40, Chapter 25 (1963, amended through 2025) - **Key Provisions**: - AS § 40.25.110: Definitions and legislative intent - AS § 40.25.110-122: Public access rights and procedures - AS § 40.25.120: Fee provisions - AS § 40.25.120: Exemptions from disclosure ### Definitions - **Public Agency**: All state and local government agencies, including boards, commissions, and authorities - **Public Record**: Any item, regardless of format, that documents the transaction of public business - **Business Days**: Monday through Friday, excluding state holidays - **Custodian**: Official designated to maintain and provide access.",
      "recent_changes_2024_2025": "2025 **VERSION**: v0.11 **NOTE**: No statutory changes between v0.10 and v0.11 - content verified as current **VERIFICATION SOURCE**: Dual-source validation using Alaska Statutes Title 40, Chapter 25 and agency guidance **LAST STATUTORY UPDATE**: 2025 (no significant amendments identified) 2025) - **Key Provisions**: - AS § 40.25.110: Definitions and legislative intent - AS § 40.25.110-122: Public access rights and procedures - AS § 40.25.120: Fee provisions - AS § 40.25.120: Exemptions from disclosure ### Definitions - **Public Agency**: All state and local government agencies, including boards, commissions, and authorities - **Public Record**: Any item, regardless of format, that documents the transaction of public business 2025) **Source 2**: Alaska agency guidance materials (2025) --- *This process map reflects Alaska Public Records Act law as of September 2025. The reasonable time standard distinguishes Alaska's approach. For current information, consult Alaska Statutes Title 40, Chapter 25.*.",
      "response_timeline_days": -1,
      "response_timeline_type": "flexible",
      "response_timeline_description": "Timeline not clearly specified in statute",
      "response_timeline_factors": [],
      "public_record_categories": [
        "Personnel record",
        "Government agency records",
        "Public official communications",
        "Financial and budgetary documents"
      ],
      "fee_structure": {
        "standard_copying": "Actual cost of reproduction",
        "search_fees": null,
        "electronic_records": null,
        "fee_waiver_available": false,
        "waiver_criteria": []
      },
      "appeal_process": {
        "type": "Court action",
        "attorney_fees_available": false,
        "timeline_days": null
      },
      "key_features_tags": [
        "2025 Amendments",
        "Reasonable Time Standard"
      ],
      "official_resources": {
        "statute_url": null,
        "ag_page_url": null,
        "request_portal_url": null
      },
      "metadata": {
        "version": "v0.11",
        "verification_date": "2025-09-26",
        "process_map_source": "Alaska-Public-Records-v0.11.md",
        "extraction_date": "2025-09-29"
      }
    },
    {
      "jurisdiction_code": "AZ",
      "jurisdiction_name": "Arizona",
      "statute_abbreviation": "PRL",
      "statute_full_name": "- **Arizona Public Records Law**: Arizona Revised Statutes § 39-121 et seq.\n- **Original Enactment**: 1962\n- **Major Revision**: 2012 (comprehensive reform)\n- **Recent Updates**: 2023 (HB 2568 - electronic records and fee protections)",
      "core_principle": "Public records belong to the people and should be accessible except as otherwise provided by law.",
      "recent_changes_2024_2025": "2025 **VERSION**: v0.11 **NOTE**: No statutory changes between v0.10 and v0.11 - content verified as current **VERIFICATION SOURCE**: Dual-source validation using ARS § 39-121 and court decisions **LAST STATUTORY UPDATE**: 2023 (HB 2568 - electronic records and fee limitations)",
      "response_timeline_days": 10,
      "response_timeline_type": "business",
      "response_timeline_description": "10 business days from receipt of request",
      "response_timeline_factors": [],
      "public_record_categories": [
        "Personnel record",
        "Government agency records",
        "Public official communications",
        "Financial and budgetary documents"
      ],
      "fee_structure": {
        "standard_copying": "Actual cost of reproduction",
        "search_fees": null,
        "electronic_records": null,
        "fee_waiver_available": false,
        "waiver_criteria": []
      },
      "appeal_process": {
        "type": "Court action",
        "attorney_fees_available": false,
        "timeline_days": null
      },
      "key_features_tags": [
        "Attorney Fees Available",
        "10-Day Deadline"
      ],
      "official_resources": {
        "statute_url": null,
        "ag_page_url": null,
        "request_portal_url": null
      },
      "metadata": {
        "version": "v0.11",
        "verification_date": "2025-09-26",
        "process_map_source": "Arizona-PRL-v0.11.md",
        "extraction_date": "2025-09-29"
      }
    },
    {
      "jurisdiction_code": "AR",
      "jurisdiction_name": "Arkansas",
      "statute_abbreviation": "FOIA",
      "statute_full_name": "- **Arkansas FOIA**: Arkansas Code Title 25, Chapter 19 (1967, amended through 2025)\n- **Key Provisions**:\n  - Ark. Code § 25-19-103: Definitions and legislative intent\n  - Ark. Code § 25-19-104: Public access rights\n  - Ark. Code § 25-19-105: Response timeline and enforcement\n  - Ark. Code § 25-19-106: Fee provisions\n  - Ark. Code § 25-19-107: Exemptions from disclosure",
      "core_principle": "Public access rights - Ark. Code § 25-19-105: Response timeline and enforcement - Ark.",
      "recent_changes_2024_2025": "2025 **VERSION**: v0.11 **NOTE**: No statutory changes between v0.10 and v0.11 - content verified as current **VERIFICATION SOURCE**: Dual-source validation using Arkansas Code Title 25, Chapter 19 and 2025 Acts 505 & 922 amendments **LAST STATUTORY UPDATE**: 2025 (Act 505 and Act 922 - significant amendments) 2025) - **Key Provisions**: - Ark. Code § 25-19-103: Definitions and legislative intent - Ark. Code § 25-19-104: Public access rights - Ark.",
      "response_timeline_days": -1,
      "response_timeline_type": "flexible",
      "response_timeline_description": "Timeline not clearly specified in statute",
      "response_timeline_factors": [],
      "public_record_categories": [
        "Personnel record",
        "Government agency records",
        "Public official communications",
        "Financial and budgetary documents"
      ],
      "fee_structure": {